,Fecha_Publicación,Titulo,viewCount,likeCount,dislikeCount,commentCount,Duración_segs,Tags,Descripcion,videoID,Edicion
83,2014-02-12,Un plan B para salvar al mundo: Alberto D'Andrea at TEDxRosario,25982,338,13,36,683,"['TEDx', 'tedxrosario', 'tedxrosario2013', 'rosario', 'argentina', 'santa fe', 'bioeconomia', 'biofabrica', 'transgenica', 'georgescu', 'nicholas', 'biotecnologia', 'biotechnology', 'spanish', 'español', 'UCES', 'science', 'technology', 'prometheus', 'plan b', 'bio', 'ingenieria genetica', 'biofactory', 'bioeconomy', 'salud', 'alimentos', 'global issues', 'Algae (Organism Classification)', 'bioenergia', 'bioenergy', 'activism', 'social change', 'medioambiente', 'reciclar', 'food', 'sustainability', 'climate change', 'health', 'sustentabilidad', 'genes', 'genetica', 'biopetroleo', 'microalgas', 'poema', 'roegen']","Alberto nos presenta un panorama bastante sombrío acerca de la incidencia del hombre sobre la naturaleza. Nos cuenta también que no existe un Plan A para prepararnos para los problemas que se avecinan. Sin embargo, aclara que hay un Plan B y nos contagia con su pasión el deseo para llevarlo a cabo.

Alberto es Profesor en la Especialidad Química egresado de la Facultad de Filosofía y Letras (UBA), Licenciado en Química Biológica y Doctor en Ciencias Químicas egresado de la Facultad de Ciencias Exactas y Naturales (UBA).

Cursó un Posgrado en Ingeniería Biomédica en la Facultad de Medicina (UBA) - Fundación Favaloro. Publicó textos relacionados con la enseñanza tanto presencial como a distancia, y numerosos trabajos científicos originales de investigación en revistas especializadas internacionales.

Actualmente es Director de la Licenciatura en Biotecnología de la UADE, Presidente de la Confederación Argentina de Biotecnología, miembro de la European Federation of Biotechnology y creador-columnista del programa Café Biotecnológico en la AM 890.

Twitter: @gengenial

TEDxRosario se realiza en la ciudad de Rosario, Argentina
http://www.TEDxRosario.com.ar

About TEDx:
In the spirit of ideas worth spreading, TEDx is a program of local, self-organized events that bring people together to share a TED-like experience. At a TEDx event, TEDTalks video and live speakers combine to spark deep discussion and connection in a small group. These local, self-organized events are branded TEDx, where x = independently organized TED event. The TED Conference provides general guidance for the TEDx program, but individual TEDx events are self-organized.* (*Subject to certain rules and regulations)",QOMITKXOSHo,TEDxRosario 2013: Atrevete a lo imposible - 09/10/2013
84,2013-12-18,Todos somos baldoseros: Juan Castro at TEDxRosario,14102,236,4,20,1068,"['TEDx', 'entertainment', 'sports', 'deportes', 'argentina', 'tedxrosario', 'tedxrosario2013', 'santa fe', 'buenos aires', 'juan claudio castro', 'social change', 'culture', 'Comedy', 'comedia', 'futbol', 'soccer', 'nob', 'central', 'rosario central', ""Newell's Old Boys (Football Team)"", 'maradona', 'chirumbolo', 'fontanarrosa', 'racing', 'spanish', 'español', 'alfonsin', 'suller', 'torneo', 'apertura', 'clausura', 'goles', 'Ángel Tulio Zof (Football Player)', 'rosario', 'fracasado', 'muerto', 'en una baldosa', 'baldosero', 'horrible', 'pechofrio', 'valderrama', 'enunabaldosa', 'sinaliento', 'sina', 'canal 3']","Juan Castro se pregunta si el fracaso es la ausencia de triunfos y nos cuenta varias historias sobre el fútbol argentino que rozan lo bizarro. 

El inicio de Juan en el periodismo, allá por el 2001, coincidió con el campeonato en que Racing, el club de sus amores, salió campeón luego de 35 años.

Durante más de una década formó parte de Maldita Radio (Rock & Pop Beach), un programa de radio, originalmente creado para ganar minitas, que en 2009 obtuvo el Martín Fierro Federal en el rubro Entretenimientos.

En 2004 fundó el blog En Una Baldosa, para homenajear a jugadores no tan recordados del fútbol argentino que, con el tiempo, fue agrandándose hasta obtener su propio espacio radial. Su cuenta de Twitter fue premiada en los Tweets Awards de 2011 y 2012 por haberse vuelto un referente para miles de personas, en especial, amantes del fútbol.

Trabajó y colaboró en medios como Rock & Pop, Metro, Maxim, Olé y Diario Popular y, actualmente, planifica estrategias creativas para grandes marcas (aunque él mismo prefiere reconocer que les roba).

Mientras espera la edición del primer libro de ""En una baldosa"", se prepara para viajar a Brasil el año que viene y cumplir el sueño de su vida: cubrir un mundial de fútbol.

TEDxRosario se realiza en la ciudad de Rosario, Argentina
http://www.TEDxRosario.com.ar

About TEDx:
In the spirit of ideas worth spreading, TEDx is a program of local, self-organized events that bring people together to share a TED-like experience. At a TEDx event, TEDTalks video and live speakers combine to spark deep discussion and connection in a small group. These local, self-organized events are branded TEDx, where x = independently organized TED event. The TED Conference provides general guidance for the TEDx program, but individual TEDx events are self-organized.* (*Subject to certain rules and regulations)",99KHEKfLwAg,TEDxRosario 2013: Atrevete a lo imposible - 09/10/2013
85,2014-02-07,¿Una silla de ruedas controlada con la mente? Juan Pablo Manson at TEDxRosario,3793,34,5,4,1003,"['TEDx', 'spanish', 'español', 'argentina', 'rosario', 'santa fe', 'tedxrosario', 'tedxrosario2013', 'technology', 'science', 'Science Fiction (Literary Genre)', 'medicine', 'health', 'wheelchair', 'mind', 'control', 'telekinesis', 'telequinesis', 'silla de ruedas', 'tan le', 'Emotiv Lifescience', 'electroencephalography', 'EEG', 'interactive', 'dynamics', 'gaston', 'pereira', 'puyo', 'fundacion rosarina de neurorehabilitacion', 'neurorehabilitacion', 'neuro', 'rehabilitacion', 'canal 3', 'Computer', 'Brain', 'Robot', 'Body', 'Remote', 'Electronics', 'quadriplegico', 'brainstorm']","Juan Pablo se dedica a investigar las interfaces entre el hombre y la maquina. Si bien su objetivo es que nuestro cerebro pueda controlar a la tecnología, su vision es encontrar una tecnología que nos pueda tocar el corazón. 

Activista tecnológico iniciado en los 80s que, a la precoz edad de 23 años, monta su primer compañía ""Open Automation"", donde se desempeñó como director de tecnología.

Paralelamente a su empresa de soluciones aplicadas a la automatización industrial, Juan recorrió la noche rosarina como cantante en bandas de rock.

En 2010 fue elegido Presidente del Polo Tecnológico de Rosario y logró preparar el viejo Batallón 121 para el desarrollo del Area Tecnológica Rosario donde se asentarán empresas rosarinas de tecnología. Actualmente coordina el eje de I+D+i en dicha institución.

Para el 2011, la búsqueda de otros rumbos lo lleva, junto con sus amigos, a nuevos emprendimientos: OpenHacks.Com (e-Commerce de productos electrónicos con el concepto de hardware libre), e Interactive Dynamics (experiencias interactivas basadas en interfaces de usuarios naturales- NUI-), de donde hoy es CTO.

Juan se interesa e investiga sobre Inteligencia Artificial e interfaces Cerebro-Computadora y es parte del equipo de desarrollo de una silla de ruedas inteligente controlada por el pensamiento para que aquellas personas con movilidad reducida cuenten con una nueva alternativa de independencia.

TEDxRosario se realiza en la ciudad de Rosario, Argentina
http://www.TEDxRosario.com.ar

About TEDx:
In the spirit of ideas worth spreading, TEDx is a program of local, self-organized events that bring people together to share a TED-like experience. At a TEDx event, TEDTalks video and live speakers combine to spark deep discussion and connection in a small group. These local, self-organized events are branded TEDx, where x = independently organized TED event. The TED Conference provides general guidance for the TEDx program, but individual TEDx events are self-organized.* (*Subject to certain rules and regulations)",BX6Hi-K_AQE,TEDxRosario 2013: Atrevete a lo imposible - 09/10/2013
86,2014-02-21,Performance: Coki & The Killer Burritos at TEDxRosario,4442,31,0,7,816,"['ted x', 'tedx', 'Julián Acuña di Mauricio', 'rosario', 'compositor', 'tedx talk', 'ted talk', 'piano', 'coki', 'ted talks', 'Tito Barrera', 'santa fe', 'componer', 'argentina', 'performance', 'cesar debernardi', 'spanish', 'burritos', 'song', 'español', 'Songwriter (Profession)', 'compose', 'tedxrosario', 'guitar', 'tedx talks', 'music', 'Martin Rougier', 'Franco Mascoti', 'tedxrosario2013', 'ted', 'TEDx', 'killer', 'drums', 'bass', 'singer', 'MIGUEL VILLALBA']","Coki nos propone acompañarlo en el proceso de composición de un nuevo tema junto a The Killer Burritos!

Coki & the Killer Burritos se forma en el año 1998 luego de que se disolviera Punto G, grupo con el que Coki grabó tres discos en su Rosario natal.
Originalmente estaba integrada por los músicos de Mortadela Rancia (Gonzalo Aloras, Lisandro Falcone y Diego Giordano). Luego de participar en el festival ""Ni un paso atrás"" realizado en el estadio de Rosario Central y a beneficio de las Madres de Plaza de Mayo, Coki ingresó en los estudios Alfa Centauro para registrar ""Mi parrillada"" sin una formación fija, sino con la participación de diversos músicos, entre ellos Aloras, Fabián Gallardo, Carlos González, Fabián Llonch y Andrés Calamaro como invitado.
En el 2001 realizaron una gira por España y al regresar grabaron ""Un millón de dólares"" en los estudios Circo Beat. Por entonces, Debernardi era acompañado por Emiliana Arias (batería) y Julián Acuña (guitarras).e
En el año 2004 el mismo trío registró el disco ""Perdida"", 
A fines de 2007 lanzó ""No creamos nada"", un EP de cinco covers, que publicó gratuitamente en internet.
En el 2010 se convierten en la banda estable de Fito Paez recorriendo latinoamerica y España durante dos años
En la actualidad la banda se encuentra preparando su disco,tocando por todos lados y con la siguiente formación:
Tito Barrera: Bateria 
Miguel Villalba: Bajo 
Franco Mascoti: Guitarra 
Martin Rougier: Teclados 
Coki Debernardi: Guitarra y Voz

TEDxRosario se realiza en la ciudad de Rosario, Argentina
http://www.TEDxRosario.com.ar

About TEDx:
In the spirit of ideas worth spreading, TEDx is a program of local, self-organized events that bring people together to share a TED-like experience. At a TEDx event, TEDTalks video and live speakers combine to spark deep discussion and connection in a small group. These local, self-organized events are branded TEDx, where x = independently organized TED event. The TED Conference provides general guidance for the TEDx program, but individual TEDx events are self-organized.* (*Subject to certain rules and regulations)",QisUIpucjE0,TEDxRosario 2013: Atrevete a lo imposible - 09/10/2013
87,2014-04-21,Dos argentinos contra el hambre en África: Emiliano Mroue at TEDxRosario,9675,80,2,6,981,"['capitan sarmiento', 'sustainability', 'empresas sociales', 'ted x', 'ted talk', 'west african rice company', 'Agriculture (Professional Field)', 'TEDx', 'argentino', 'tedxrosario', 'tedx talks', 'expatriado', 'ted', 'arroz', 'agricultura', 'argentina', 'tedx talk', 'africa', 'spanish', 'activism', 'sierra leona', 'buenos aires', 'ted talks', 'global issues', 'patricio imerito', 'tedx', 'business', 'food', 'Sierra Leone (Country)', 'rosario', 'warc', 'santa fe', 'Rice (Cereal)', 'community', 'social change']","Se podría decir que Emiliano es uno de esos míticos casos donde una persona deja su laburo para ir a poner un bar a la playa. Solo que en este caso, en vez de un bar es una empresa social y, en vez de una playa, son los inundados campos arroceros de Sierra Leona en África. 
La empresa que fundó junto a su primo ha ayudado a cientos de familias africanas a encontrar un camino para escapar de la mera subsistencia hacia el desarrollo sostenible. 

Emiliano es Socio y Director General en ""The West African Rice Company"" un negocio inclusivo de agricultura sostenible en Sierra Leona, habiendo sido galardonada por Su Excelencia, el Presidente de la República de Sierra Leona como la empresa agricola más importante del país. 

Emiliano ha estado, previamente a su constitución como empresario en África, involucrado en el desarrollo e implementación de proyectos de energías renovables en América Latina y África.

Emiliano se graduó como Licenciado en Economía Empresarial, por la Universidad Torcuato di Tella, en Argentina, donde se le fue atribuida la beca Starlight para realizar estudios en la WU Universitaet, en Austria. Mas tarde ha ganado una beca para realizar el CEMS Master in International Management, en la escuela de negocios ESADE, en España, y en la Universidad de Colonia, en Alemania. Actualmente es candidato nivel III al Chartered Financial Analyst (CFA).

Emiliano tiene también una fuerte pasión por los viajes, muchos de ellos de aventura. Como ""logros"" mayores ha cruzado Latinoamérica, desde Bolivia a la Ciudad de México en transporte publico, ha recorrido Irán y Afganistán en la misma modalidad y ha visitado más de 50 países.  Finalmente, también ha contribuido al fundraising de diversas ONG tales como Fundación Cruzada Argentina, Grameen Bank y WARC Foundation.

http://www.westafricanrice.com/

TEDxRosario se realiza en la ciudad de Rosario, Argentina
http://www.TEDxRosario.com.ar 

About TEDx:
In the spirit of ideas worth spreading, TEDx is a program of local, self-organized events that bring people together to share a TED-like experience. At a TEDx event, TEDTalks video and live speakers combine to spark deep discussion and connection in a small group. These local, self-organized events are branded TEDx, where x = independently organized TED event. The TED Conference provides general guidance for the TEDx program, but individual TEDx events are self-organized.* (*Subject to certain rules and regulations)",g8YIDiQW7Bs,TEDxRosario 2013: Atrevete a lo imposible - 09/10/2013
88,2014-01-27,La filosofía del rugby aplicada a la vida: Federico Pucciariello at TEDxRosario,52475,778,18,13,776,"['sports', 'santa fe', 'ted x', 'español', 'spanish', 'culture', 'sustentable', 'rosario', 'life', 'ted talks', 'sport', 'TEDx', 'reciclar', 'tedx', 'barbarians', 'bioenergy', 'consumo', 'coeficiente biologico', 'aceites', 'bio', 'rugby', 'global issues', 'activism', 'argentina', 'ovalada', 'climate change', 'cambio climatico', 'ted talk', 'biocombustibles', 'planeta', 'rafaela', 'teamwork', 'food', 'equipo', 'tedx talk', 'filosofia', 'biodiesel', 'sustainability', 'social change', 'tedxrosario', 'tedxrosario2013', 'ted', 'tedx talks']","Fede nos insta a nunca soltar la pelota! Y nos cuenta por qué al retirarse del rugby decidió fundar una de las empresas de biocombustible más grandes del país! 

Federico emigró a Europa a los 21 años para dedicarse profesionalmente al Rugby. ¡Y qué bien le fue!: campeón de la liga inglesa y celta, dos veces campeón para Europa e invitado 5 veces para Barbarians Británicos.

Fue, desde siempre, un gran emprendedor y apasionado defensor del medio ambiente enfocado principalmente al desarrollo de nuevas tecnologías amigables y sustentables.

Tal es así, que en el 2007, dos ños previos a retirarse del rugby profesionalmente, fundó su primera empresa de Biodiesel en Roldán -Rosario Bioenergy S.A- y este año, gracias a la incorporación de la primer planta feedstcok de la región, se transformó en la primer pyme más grande del país en el rubro.

TEDxRosario se realiza en la ciudad de Rosario, Argentina
http://www.TEDxRosario.com.ar

About TEDx:
In the spirit of ideas worth spreading, TEDx is a program of local, self-organized events that bring people together to share a TED-like experience. At a TEDx event, TEDTalks video and live speakers combine to spark deep discussion and connection in a small group. These local, self-organized events are branded TEDx, where x = independently organized TED event. The TED Conference provides general guidance for the TEDx program, but individual TEDx events are self-organized.* (*Subject to certain rules and regulations)",Sg6SEzTUhJU,TEDxRosario 2013: Atrevete a lo imposible - 09/10/2013
89,2014-01-11,¿Cómo deberíamos vivir? Daniel Scarfò at TEDxRosario,5356,32,2,2,1045,"['tedx', 'bertrand', 'tedx talk', 'bailar', 'TEDx', 'educación', 'ted x', 'russel', 'argentina', 'cultura', 'ted talks', 'music', 'culture', 'bee gees', 'leer', 'santa fe', 'filosofía', 'ted talk', 'español', 'sociologia', 'dance', 'john travolta', 'ted', 'tedxrosario2013', 'vilas', 'psychiology', 'tedx talks', 'flacso', 'tedxrosario', 'global issues', 'lifestyle', 'rosario', 'spanish']","¿Qué tipos de movimientos necesitamos para tener una buena vida? Se pregunta Daniel y nos cuenta las conclusiones a las que arribó en su vida. 

Daniel es licenciado y Profesor en Sociología (UBA) y Ph. D. en Español y Portugués (Yale). Estudió, también, Literatura Comparada en la Universidad de Puerto Rico y Estudios Portugueses en la Universidad de Lisboa y enseñó durante 25 años en diversas universidades de Argentina, Canadá y E.E.U.U.

Actualmente es Profesor de la Universidad Austral y Director del Museo Sarmiento. En busca de una comprensión ecocrítica de las conexiones entre los mundos biológicos y sociales, las narrativas éticas y la necesidad de una nueva educación sentimental y ecológica, siempre consideró urgente prepararnos en los conocimientos y sensibilidades de otras culturas, literaturas, lenguajes y especies. Eso lo tuvo toda su vida cerca de los viajes, las palabras y los animales.

TEDxRosario se realiza en la ciudad de Rosario, Argentina
http://www.TEDxRosario.com.ar

About TEDx:
In the spirit of ideas worth spreading, TEDx is a program of local, self-organized events that bring people together to share a TED-like experience. At a TEDx event, TEDTalks video and live speakers combine to spark deep discussion and connection in a small group. These local, self-organized events are branded TEDx, where x = independently organized TED event. The TED Conference provides general guidance for the TEDx program, but individual TEDx events are self-organized.* (*Subject to certain rules and regulations)",Yz6VWRCIhgc,TEDxRosario 2013: Atrevete a lo imposible - 09/10/2013
90,2014-01-01,Pequeño gran bandoneonista: Guido Gavazza at TEDxRosario,4879,54,5,8,464,"['tedxrosairo', 'ted x', 'performance', 'entertainment', 'tedx talks', 'culture', 'argentina', 'music', 'TEDx', 'folklore', 'español', 'ted talk', 'acordion', 'folclore', 'ted talks', 'young', 'santa fe', 'song', 'bandoneon', 'ted', 'acordeon', 'tango', 'rosario', 'tedxrosario2013', 'musica', 'tedx', 'Tango (Musical Genre)', 'spanish', 'tedx talk']","Guido inició su formación musical a los 6 años y sus estudios de bandoneón a los 7.

Participó, desde chico, en audiciones y en el 2006 incorporó temas de Astor Piazolla a su repertorio que lo llevaron a presentarse en la Escuela Municipal de Música junto a otros alumnos del taller Suzuki de piano. Al año siguiente participó como invitado de Primer Festival Internacional de Suzuki de Rosario y desde entonces ha sido convocado para participar de destacados eventos a nivel nacional. Entre ellos, en el 198° Aniversario de la Creación de la Bandera en el Monumento.

En el 2012 editó su primer CD, ""Un bando de neón"" que incluye dos temas de su autoría y, este año, fue invitado al Festival de Orquestas Infanto-juveniles donde se presentó con el Quinteto Tango conformado por Manuel Martinez (piano), Pablo Galimberti (violín), Julian Cicerchia (guitarra) y Mauro Rodriguez (bajo). El festival contó con el padrinazgo artístico de Elena Roger.

TEDxRosario se realiza en la ciudad de Rosario, Argentina
http://www.TEDxRosario.com.ar

About TEDx:
In the spirit of ideas worth spreading, TEDx is a program of local, self-organized events that bring people together to share a TED-like experience. At a TEDx event, TEDTalks video and live speakers combine to spark deep discussion and connection in a small group. These local, self-organized events are branded TEDx, where x = independently organized TED event. The TED Conference provides general guidance for the TEDx program, but individual TEDx events are self-organized.* (*Subject to certain rules and regulations)",LCdQCjEaDB4,TEDxRosario 2013: Atrevete a lo imposible - 09/10/2013
91,2014-10-01,Charla de asesinos seriales | José Alejandro Silberstein  | TEDxRosario,3163,30,3,0,494,"['tedx', 'Career/Life Development', 'tedx talks', 'Social Science', 'Spanish', 'ted x', 'ted talks', 'Sociology', 'ted talk', 'ted', 'Culture', 'History', 'TEDxTalks', 'Psychology', 'Argentina', 'Criminology', 'tedx talk']","This talk was given at a local TEDx event, produced independently of the TED Conferences. ¿Cómo nace un asesino serial? ¿Cuáles fueron los más famosos? ¿Por qué hay tantos en las películas pero no en las noticias? ¿Qué probabilidades hay de que yo conozca a uno?  Son algunas de las preguntas que buscarán respuesta en esta extraña entrevista.

José es profesor de Criminología en Seguridad Pública de la Universidad del Salvador y psiquiatra especialista en asesinos seriales.

Cursó sus estudios de Medicina en la Universidad de Rosario e hizo su entrenamiento en psiquiatría en el Hospital Italiano de Buenos Aires, en la Comunidad Terapéutica Psicoanalítica, en el Departamento de Terapia Familiar del Hospita Hahnemann (Filadelfia, Estados Unidos), el Calgary General Hospital y la Universidad de Calgary (Calgary, Alberta, Canadá), donde obtuvo un Fellowship en psiquiatría forense.

Ha publicado numerosos trabajos en medicina familiar, psicosomática y psiquiatría forense en nuestro país y en el extranjero.

José es autor de Desarrollo Emocional y Dinámica Familiar: un enfoque biopsicosocial del proceso de diferenciación de las relaciones matrimoniales y familiares, y de Mentes que Agonizan, ambos publicados por UNR Editora.

Actualmente reside en Rosario, donde ejerce la actividad privada y la tarea docente como profesor de Psicología Forense en la Facultad de Psicología de la Universidad Católica de la Plata (Sede Académica de Rosario).

About TEDx, x = independently organized event In the spirit of ideas worth spreading, TEDx is a program of local, self-organized events that bring people together to share a TED-like experience. At a TEDx event, TEDTalks video and live speakers combine to spark deep discussion and connection in a small group. These local, self-organized events are branded TEDx, where x = independently organized TED event. The TED Conference provides general guidance for the TEDx program, but individual TEDx events are self-organized.* (*Subject to certain rules and regulations)",hWFg8kJhglA,TEDxRosario 2013: Atrevete a lo imposible - 09/10/2013
92,2014-09-17,Desafios de educar en contextos de nuevas tecnologias | Aníbal Rossi | TEDxRosario,21424,175,8,2,1021,"['ted x', 'Education', 'Spanish', 'Linguistics', 'Argentina', 'tedx talks', 'Anthropology', 'tedx talk', 'Philosophy', 'ted talks', 'ted talk', 'tedx', 'TEDxTalks', 'Culture', 'ted', 'Sociology', 'Career/Life Development', 'Social Media']","This talk was given at a local TEDx event, produced independently of the TED Conferences. Aníbal nos explica por medio de la fabula de Narciso, los desafíos para la educación en un mundo con tecnologías que cambian cada vez más rápidamente.

Aníbal nació hace 33 años. Licenciado en Comunicación Social. Le apasiona la filosofía tanto como la artesanía digital, de hecho admira menos a Sócrates que a McGyver. Lector voraz que anhela mutar en gamer.

Le da pudor llamarse músico aunque se le anima a varios instrumentos.

Es docente universitario.

Le gusta enseñar lo que no sabe para así aprender con/de sus alumnos, esto es sin duda lo que más lo gratifica.

About TEDx, x = independently organized event In the spirit of ideas worth spreading, TEDx is a program of local, self-organized events that bring people together to share a TED-like experience. At a TEDx event, TEDTalks video and live speakers combine to spark deep discussion and connection in a small group. These local, self-organized events are branded TEDx, where x = independently organized TED event. The TED Conference provides general guidance for the TEDx program, but individual TEDx events are self-organized.* (*Subject to certain rules and regulations)",HXMmaZgylVo,TEDxRosario 2013: Atrevete a lo imposible - 09/10/2013
