,Fecha_Publicación,Titulo,viewCount,likeCount,dislikeCount,commentCount,Duración_segs,Tags,Descripcion,videoID,Edicion
118,2012-01-01,TEDxRosario - Chiqui González - Ser un Salto,25184,228,3,12,1166,"['olvido', 'spanish', 'Rosario', 'Argentina', 'culture', 'solidaridad', 'español', 'cultura', 'secretaria', 'psycology', 'tedx talk', 'community', 'ministra', 'TEDx', 'ted', 'rostower', 'santa fe', 'buenosaires', 'honradez', 'global issues', 'tedx talks', 'education', 'percepción', 'ted talks', 'social change', 'ted talk', 'ted x', 'riodelaplata', 'tedx', 'afecto', 'ministerio', 'comunidad']","TEDxRosario se realiza en la ciudad de Rosario, Argentina
http://www.tedxrosario.com.ar

Chiqui Gonzalez nos enseña que el afecto es un verbo!

Chiqui ha dedicado su vida a trabajar en diferentes espacios y ámbitos de la cultura. Mayormente en la ciudad de Rosario, donde nació y se crió en el barrio Saladillo, para luego comenzar una extensa producción teatral como actriz, directora y dramaturga dentro y fuera del país.

Habiendo estudiado Derecho de Familia con Posgrado de la Facultad de Derecho y Ciencias Políticas de la UNR, ejerció muy poco tiempo para luego dedicarse de lleno junto a grandes artistas a proyectos como ""Desnuda de terciopelo"", (1993-2002 -- Ganadora del premio Estrella de mar), ""Bajo el ala del sombrero"", (1989-1993 -- Agrupación Filodramática ""Te quisimos con locura""), y ""Orquesta de señoritas"" (1998 -- En el marco del Primer Encuentro Internacional de Escritoras), entre muchas otras que perduran en el acervo cultural de la ciudad.

Asimismo fue participe de la apertura de diversos circuitos de teatro independiente como la Sociedad del Ángel, Agrupación Discepolín y el Teatro Arteón.

Ya los 90 la encontraron con nuevos desafíos y equipos de trabajo, sin perder el vínculo con la docencia, la formación, la creación y la invención. Tuvo a su cargo así la Dirección General del Centro del Expresiones Contemporáneas (1996 -- 1999), el Proyecto ""La Ciudad de los Niños"" (1996 -- 2001) y la Isla de los Inventos (2004 -- 2006).

De esta manera surgiría un gran amor que la acompañaría hasta el día de hoy: los niños, el juego, la infancia, las imágenes y el trabajo cotidiano con los ciudadanos. Desde esta iniciativa se ocupó del diseño, marco conceptual, dirección del equipo creador y asesor, así como la creación de muestras y dispositivos lúdicos del ""Tríptico de la infancia"" de Rosario, integrado por la Granja de la Infancia, el Jardín de los niños y la Isla de los Inventos que actualmente son orgullo de todos y nos representan en el exterior.

No abandonó nunca de dar clases y como lo viene haciendo desde hace más de una década viaja a la Escuela Internacional de Cine y Televisión ECTV, de San Antonio de los Baños, Cuba y es profesora de las materia ""Teoría y estética de los Medios"" y ""Dirección de Actores"" de la Carrera Diseño de Imagen y Sonido Facultad de Arquitectura, Diseño y Urbanismo, Universidad Nacional de Buenos Aires (FADU -- UBA). Ciudad de Buenos Aires. A la vez que dicta permanentemente talleres, seminarios, conferencias y capacitaciones en el país y el exterior.

Entre el 2006 y 2007 fue Secretaría de Cultura de la ciudad Rosario y desde diciembre del 2007 se desarrolla como Ministra de Innovación y Cultura del Gobierno de la Provincia de Santa Fe, lo que le permitió conocer muchas otras realidades, abrir su abanico de acción para seguir creando. En estos años abrió junto a destacados equipos de colaboradores ""El Molino"", Fábrica Cultural, ""La Redonda"", Arte y Vida Cotidianda y La Esquina Encendida, tres nuevos ámbitos de participación, construcción, juego y aprendizaje públicos y abiertos a todos los ciudadanos, que junto al Tríptico de la Infancia de Rosario buscan una nueva manera de ver los vínculos sociales a través de un pensamiento
innovador.

About TEDx:
In the spirit of ideas worth spreading, TEDx is a program of local, self-organized events that bring people together to share a TED-like experience. At a TEDx event, TEDTalks video and live speakers combine to spark deep discussion and connection in a small group. These local, self-organized events are branded TEDx, where x = independently organized TED event. The TED Conference provides general guidance for the TEDx program, but individual TEDx events are self-organized.* (*Subject to certain rules and regulations)",JC86OfCRb4Q,TEDxRosario 2011 - 16/09/11
119,2012-01-01,TEDxRosario - Alfons Cornella - Lo radical es normal,16825,111,6,3,1191,"['innovacion', 'negocios', 'infonomia', 'tedx talks', 'rostower', 'co', 'TEDx', 'sustainability', 'tecnologia', 'ted', 'Argentina', 'cosociety', 'Rosario', 'buenosaires', 'society', 'español', 'españa', 'business', 'tedx talk', 'tedx', 'Barcelona', 'red', 'update', 'colaboración', 'ted talk', 'technology', 'innovadores', 'community', 'futuro', 'ted talks', 'riodelaplata', 'madrid', 'culture', 'spain', 'spanish', 'ted x']","TEDxRosario se realiza en la ciudad de Rosario, Argentina
http://www.tedxrosario.com.ar

Alfons nos muestra como lo radical pasa a ser la norma y nos deja vislumbrar un futuro donde todo es Co-.

http://www.infonomia.com

Fundador y presidente de Infonomia, la red de innovadores de referencia en lengua española (más de 24.000 personas registradas y un millón de páginas vistas al mes). Ha publicado 17 libros sobre ciencia, tecnología e innovación, así como 1.000 artículos sobre cómo las tecnologías pueden transformar la empresa. Es consultor de grandes empresas del país. A través de sus conferencias y seminarios sobre innovación transmite personalmente sus ideas y experiencias sobre ""cómo innovan los mejores"" a unas 15.000 personas anualmente.

Autor de Futuro Presente: 101 ideas fuerza para entender las próximas décadas (2005), La Alquimia de la Innovación (2007), en coautoría con Antonio Flores, Visionomics, 50 ideas y dibujos sobre la nueva dinámica de las organizaciones (2010) y 25/50 Dos generaciones, un mismo tiempo, en coautoria con Berta Segura (2011).

About TEDx:
In the spirit of ideas worth spreading, TEDx is a program of local, self-organized events that bring people together to share a TED-like experience. At a TEDx event, TEDTalks video and live speakers combine to spark deep discussion and connection in a small group. These local, self-organized events are branded TEDx, where x = independently organized TED event. The TED Conference provides general guidance for the TEDx program, but individual TEDx events are self-organized.* (*Subject to certain rules and regulations)",SKT5RCIkIEc,TEDxRosario 2011 - 16/09/11
120,2012-01-01,TEDxRosario - Derna Isla - Yo también tengo un sueño,3169,24,0,1,1110,"['ted x', 'Solidaria', 'tedx talk', 'education', 'music', 'marginales', 'sinfónicas', 'performance', 'tedx talks', 'TEDx', 'español', 'culture', 'fundación', 'violoncelo', 'buenosaires', 'ted', 'rostower', 'orquestas', 'Abanderados', 'activism', 'ted talks', 'Argentina', 'infantiles', 'ted talk', 'social change', 'allegro', 'santa fe', 'community', 'Rosario', 'tedx', 'global issues', 'spanish']","TEDxRosario se realiza en la ciudad de Rosario, Argentina
http://www.tedxrosario.com.ar

Derna sueña con una red de orquestas sinfónicas infantiles en Argentina!

http://www.allegroargentina.com.ar

Derna nació en Rosario, como la mayoría de los chicos de su pueblo, pero a las horas ya estaba viviendo en Serodino, una pequeña localidad de 3.000 habitantes del Sur de la provincia de Santa Fe. Cuando tenía doce años le preguntó a una tía: ¿Para qué sirve la música? Ella veía que su papá, como médico, salvaba vidas. Pero ¿y la música? La respuesta recién la encontró de grande, cuando ya recibida de maestra y profesora nacional de música comprendió que la música podía cambiar vidas.

A partir de 1997, comenzó a trabajar en escuelas públicas y comenzó a formar pequeños coros y ensambles instrumentales. En el año 2001 creó Vibrato, un programa socio educativo a través de orquestas sinfónicas infanto juveniles. Al principio fue casi imposible obtener instrumentos (violines, violas, cellos, etc.), así que con recursos personales, apoyo de profesores y empresas reunieron la primer dote de instrumentos, dictando clases ad honorem. El proyecto creció y después de visitar 23 escuelas fundó la Orquesta de Violines del Hogar del Huérfano, la Escuela Orquesta del Barrio de Ludueña en una comunidad Salesiana y la Escuela Orquesta de la Esperanza en la comunidad del Padre Ignacio Peries, contando con financiamiento de la Secretaría de Cultura de la Municipalidad de Rosario, empresas de la región y organismos internacionales.

Es fundadora de la Fundación Allegro Argentina, cuya misión es la formación de una Red Sistema de Orquestas Infantiles y Juveniles, como herramienta de promoción y transformación socio educativa.

About TEDx:
In the spirit of ideas worth spreading, TEDx is a program of local, self-organized events that bring people together to share a TED-like experience. At a TEDx event, TEDTalks video and live speakers combine to spark deep discussion and connection in a small group. These local, self-organized events are branded TEDx, where x = independently organized TED event. The TED Conference provides general guidance for the TEDx program, but individual TEDx events are self-organized.* (*Subject to certain rules and regulations)",3IWrOdatwt0,TEDxRosario 2011 - 16/09/11
121,2012-01-01,Las ideas se comparten: Diego Castellon at TEDxRosario,4841,22,2,1,263,"['tedx talks', 'español', 'santa fe', 'intervención', 'creatividad', 'TEDx', 'Rosario', 'rostower', 'share', 'publicidad', 'ted x', 'ideas', 'ted', 'wawanco', 'Argentina', 'culture', 'lifestyle', 'global issues', 'riodelaplata', 'ted talk', 'spanish', 'tedx talk', 'buenosaires', 'tedx', 'performance', 'felicidad', 'ted talks']","TEDxRosario se realiza en la ciudad de Rosario, Argentina
http://www.tedxrosario.com.ar

Diego nos cuenta que cuando las ideas se comparten, crecen!

Diego es publicitario, sietemesino y escorpión. Hace 23 años que le pagan por ser ""Creativo"". Trabajó en agencias de Buenos Aires, Madrid y Costa Rica. Ganó premios, filmó comerciales, viajó mucho y aprendió a surfear casi a los 40. Es docente de creatividad y estudiante de la vida. Pinta, cocina y sobre todo camina mucho mirando hacia arriba.

Aprendió de grandes maestros como Mario Castellón, Ernesto Savaglio, Ramiro Agulla, Carlos Bacetti, Fernando Fernández, Sebastián Wilhem, Javier Fábregas, Damián Kepel, Daniel Verdino, Sebastián Alfíe, Oscar Cerutti, Marcos Carnevalle, Silvina Colombo, Horacio Dengis, Silvio Panizza, Andrés Castaño, Mariano Leguizamón, George Bray, el pelado Gonzáles, el Choco, Augusto Pugliese, Fabiana Renault, Ezequiel Brayer, Ignacio Porto, Germán Oliva Gerli, el Pele, Mr. Coco, Donatti, Chritian Henrriksen, Leita, Luciano medvetkin y tantas mentes poderosas más. Dice que también comenzó a aprender, pero de verdad, el día que empezó a dar clases.

Ahora vive en Rosario y habiendo recorrido semejante camino hoy sigue pensando que el destino del creativo es extraño, y que todos los destinos lo son. El destino del creativo es cursar el común de las virtudes humanas, las agonías, las luces; sentir intensamente cada instante de su vida y, ser no solo actor, sino espectador de su vida. Y la de los demás...

El creativo tiene una desventaja: el hecho de tener que operar con palabras. Las palabras, se sabe, son una materia deleznable. Las palabras cambian de connotación emocional, de sentido, pero el creativo tiene que resignarse a este manejo... y activar.

Ese es Diego Castellón y como él dice, PURA VIDA PARA TODOS!!!

About TEDx:
In the spirit of ideas worth spreading, TEDx is a program of local, self-organized events that bring people together to share a TED-like experience. At a TEDx event, TEDTalks video and live speakers combine to spark deep discussion and connection in a small group. These local, self-organized events are branded TEDx, where x = independently organized TED event. The TED Conference provides general guidance for the TEDx program, but individual TEDx events are self-organized.* (*Subject to certain rules and regulations)",4m8fqqv5fn8,TEDxRosario 2011 - 16/09/11
122,2012-01-02,TEDxRosario - Jorge Mux - Exonario: las palabras que deberían existir,9589,109,4,4,978,"['tedx talks', 'global issues', 'megaloclepcia', 'griego', 'community', 'academia', 'diccionario', 'buenosaires', 'tedx talk', 'santa fe', 'culture', 'ted', 'spanish', 'española', 'tedx', 'etimología', 'formiciar', 'real', 'ted talk', 'TEDx', 'Argentina', 'raíz', 'ted talks', 'español', 'rostower', 'latín', 'origen', 'bahía blanca', 'riodelaplata', 'omnibusalve', 'lifestyle', 'extramalar', 'lenguaje', 'claudir', 'ted x', 'entertainment', 'Rosario']","TEDxRosario se realiza en la ciudad de Rosario, Argentina
http://www.tedxrosario.com.ar

Jorge nos cuenta qué es exonario y cómo nacen las palabras!

http://www.exonario.blogspot.com

Jorge es profesor de filosofía del lenguaje y escritor. Su vida transcurre en ese difuso límite entre lo académico y lo informal. Mientras por un lado lleva adelante su carrera docente universitaria, escribe papers para enviar a congresos y participa en proyectos de investigación filosófica, por otro lado mantiene blogs en los que despunta el vicio a su pasión por la literatura.

En uno de esos blogs (www.monstruosyberenjenas.blogspot.com) escribe cuentos de ficción. En otro blog (www.queestasbuscando.blogspot.com), junto a un amigo, inventa historias fantásticas a partir de las búsquedas absurdas que la gente hace en Google. En otro (www.exonario.blogspot.com) se dedica a acuñar términos inventados, con sus correspondientes etimologías, definiciones y contextos de uso. Este último blog ya tiene más de mil trescientas palabras.

El blog Exonario cuenta con lectores en buena parte de Hispanoamérica, y ha despertado la curiosidad de ciertos medios (diarios, revistas, programas de televisión) tanto en Argentina (Clarín, Revista Ñ, diario Crítica) como en Colombia, España (Diario El País), Costa Rica y Venezuela. Si bien la tarea de crear palabras y de recrearse con palabras es parte del trabajo de un filósofo (y más aun, de un filósofo del lenguaje), Jorge insiste en que para poder concentrarse en sus blog debe olvidarse de todo lo que aprendió en su vida académica. O de casi todo.

Actualmente, está en proceso de edición el libro ""Exonario"", a través de Editorial Sudamericana.

About TEDx:
In the spirit of ideas worth spreading, TEDx is a program of local, self-organized events that bring people together to share a TED-like experience. At a TEDx event, TEDTalks video and live speakers combine to spark deep discussion and connection in a small group. These local, self-organized events are branded TEDx, where x = independently organized TED event. The TED Conference provides general guidance for the TEDx program, but individual TEDx events are self-organized.* (*Subject to certain rules and regulations)",Bi8b-0PrcJ0,TEDxRosario 2011 - 16/09/11
123,2012-01-01,TEDxRosario - Hernan Montenegro - El hombre detrás del deportista,22140,113,7,8,1098,"['negociación', 'Sport', 'contratos', 'tedx talk', 'psychology', 'Rosario', 'culture', 'jóvenes', 'global issues', 'TEDx', 'ted', 'sports', 'santa fe', 'buenosaires', 'basketball', 'spanish', 'talento', 'rostower', 'tedx talks', 'education', 'Argentina', 'social change', 'ted talk', 'tedx', 'español', 'ted x', 'profesional', 'bahía blanca', 'ted talks']","TEDxRosario se realiza en la ciudad de Rosario, Argentina
http://www.tedxrosario.com.ar

Hernan nos cuenta sobre las dificultades de que tiene un joven deportista al comienzo de su carrera profesional... 

Hernán Montenegro es un personaje único y particular; basketbolista de profesión: fue, es y será el hombre que le cambió la cara a este deporte; habiendo sido no sólo el primer jugador argentino en pisar la NBA, sino también un hombre inquieto, curioso, audaz y lo más importante: autodidacta.

Estudió Business Administration en Louisiana State University, dejando la misma para dar paso a su carrera en la NBA. Domina tres idiomas; ha recorrido 72 países y vivido en 16.
En su larga y cambiante vida ha trabajado como CEO de U1st Sports (una de las agencias de representación deportiva más importantes de latinoamérica); inventó un proceso de tiernización para productos cárnicos único en el mundo.
Actuó en televisión; asiduo concurrente a programas de interés general en radio y televisión; comentarista en TyC Sports, Fox Sports, Canal 7, entre otros.
Actualmente conduce el programa Cocó Babel en Radio Mitre y da charlas en todo el país acerca de la importancia del factor humano en la realización de objetivos.

Su vida, como le gusta decir, va de lo 'sublime a lo ridículo'.

About TEDx:
In the spirit of ideas worth spreading, TEDx is a program of local, self-organized events that bring people together to share a TED-like experience. At a TEDx event, TEDTalks video and live speakers combine to spark deep discussion and connection in a small group. These local, self-organized events are branded TEDx, where x = independently organized TED event. The TED Conference provides general guidance for the TEDx program, but individual TEDx events are self-organized.* (*Subject to certain rules and regulations)",ayiFyz8Rgg4,TEDxRosario 2011 - 16/09/11
124,2012-01-01,TEDxRosario  - Damian y Nestor Delorenzi - La ciencia de la cocina,4233,28,2,1,1392,"['design', 'tedx talk', 'spanish', 'tortilla de papas', 'tedx', 'rostower', 'química', 'ingeniero', 'Argentina', 'tedx talks', 'cheff', 'science', 'ted x', 'molecular', 'Ferran', 'comida', 'Adrià', 'ted', 'riodelaplata', 'ted talks', 'food', 'santa fe', 'lifestyle', 'cocinero', 'TEDx', 'bioquimico', 'español', 'Rosario', 'ted talk', 'buenosaires']","TEDxRosario se realiza en la ciudad de Rosario, Argentina
http://www.tedxrosario.com.ar

Damian y Nestor nos demuestran que sobre la cocina quda mucho por decir!

Damián comienza su carrera en 2003, finalizado el colegio secundario, cuando ingresa en el Colegio de Cocineros 'Gato Dumas' de Rosario. En 2004 se recibe de Cocinero Profesional.

En busca de experiencia laboral se instala en Buenos Aires, dónde trabaja con Martiniano Molina y otros chefs destacados de Argentina. Se desempeña como Productor Gastronómico en el programa de TV de Canal 13 'Los cocineros en casa'.

A los 22 años es nombrado Chef Ejecutivo de la cadena Kempinski Hotels, trabajando en forma simultánea en Colonia del Sacramento (Uruguay), El Calafate y Buenos Aires.

Desde abril del 2007 se desempeña como Chef Ejecutivo del primer hotel cinco estrellas de la ciudad de Rosario, Ros Tower Hotel Spa & Convention Center. También es  productor y  conductor de su propio programa de cocina al aire libre llamado 'Pasión Por Las Brasas', que se emite por en el cable local.

Fue jurado de concursos gastronómicos a nivel nacional y dictó cursos en diferentes escuelas de cocina.

Junto con un grupo de cocineros de la ciudad creó una fundación llamada 'Rosario Cocina Ideas', cuyo objetivo principal es promover la cocina como cultura, contribuir a su desarrollo y hacerla trascender en las comunidades marginales.

Participa de Proyectos de Investigación en temas relacionados con la Ciencia de los Alimentos en la Facultad de Ciencias Médicas y en la Facultad de Ciencias Bioquímicas de la Universidad Nacional de Rosario.

Su estilo de cocina se encuadra dentro de lo que se conoce como cocina de autor y en ella adhiere a muchos conceptos de la cocina de vanguardia.

En 2010 recibió la mención de Cocinero Distinguido de Rosario, otorgado por el Concejo Municipal de la ciudad; también los premios Joven Valor, otorgado por la Academia Argentina de Gastronomía, y Destacado 2010, del Diario La Capital.

Nestor es Doctor en Bioquímica por la Universidad Nacional de Rosario; en 1999 se recibe de Cocinero Diplomado en Gato Dumas Colegio de Cocineros.

Es Profesor Adjunto en Área Fisicoquímica en la Facultad de Ciencias Bioquímicas y Farmacéuticas (UNR). Docente de Fisicoquímica y Procesos Biotecnológicos. También se desarrolla como Investigador Categoría II (Ministerio de Educación de la República Argentina).

Su especialidad es Fisicoquímica de los Alimentos. Autor de trabajos publicados en revistas científicas de renombre internacional y artículos de divulgación en el tema alimentos. Dirige varios proyectos de investigación en este campo.

Tiene 54 años, está casado y tiene cuatro hijos.

About TEDx:
In the spirit of ideas worth spreading, TEDx is a program of local, self-organized events that bring people together to share a TED-like experience. At a TEDx event, TEDTalks video and live speakers combine to spark deep discussion and connection in a small group. These local, self-organized events are branded TEDx, where x = independently organized TED event. The TED Conference provides general guidance for the TEDx program, but individual TEDx events are self-organized.* (*Subject to certain rules and regulations)",jWq_sTs8q-o,TEDxRosario 2011 - 16/09/11
125,2012-01-01,"TEDxRosario - Carolina Vardabasso - Un minuto, otra vida",4365,20,0,0,573,"['seguir adelante', 'Argentina', 'damnificado', 'tedx', 'lifestyle', 'moving on', 'psychology', 'TEDx', 'tailandia', 'global issues', 'spanish', 'victima', 'tsunami', 'sobrevivir', 'ted talks', 'thailand', 'buenosaires', 'español', 'ted', 'ted talk', 'tedx talk', 'tedx talks', 'culture', 'rostower', 'Rosario', 'ted x', 'social change']","TEDxRosario se realiza en la ciudad de Rosario, Argentina
http://www.tedxrosario.com.ar

Carolina nos enseña la diferencia entre ser una victima o un damnificado...

Insiste que todo en la vida es cuestión de actitud.

Renacer y mimetizarse es la forma de ser quien es, ya que cree que es mejor adaptarse a la situación que padecerla. Estudió Diseño de Interior y tiene a cargo una Gerencia Comercial... aunque dice que no lo padece

Disfruta de estar en casa, pantuflas, mate, música o películas. De raíces Tanas... ama las pastas los domingos en familia. Es creyente de que a mas edad la tolerancia disminuye, sin embargo, muchas veces deja que las cosas caigan por su propio peso con el solo objetivo de no confrontar.

Residió en distintos países, lo que la llevó a confiar en su instinto para ubicarme rápidamente sin mapa de por medio, lo que no puede fallar algunas veces, aunque llega siempre a destino.

Considera que ajustar bornes o cambiar un filtro de aire no la hace menos mujer sino que le soluciona muchas cosas.

Da gracias a la vida que le enseñó que todo se puede, a los chinos que le dejaron aprender algo de su filosofía, su cultura y la inigualable habilidad para negociar. Herramientas fundamentales para su vida actual.

Saber  que algún día podrá escribir un libro con su vida la lleva a decir ""pucha que vale la pena estar viva""

About TEDx:
In the spirit of ideas worth spreading, TEDx is a program of local, self-organized events that bring people together to share a TED-like experience. At a TEDx event, TEDTalks video and live speakers combine to spark deep discussion and connection in a small group. These local, self-organized events are branded TEDx, where x = independently organized TED event. The TED Conference provides general guidance for the TEDx program, but individual TEDx events are self-organized.* (*Subject to certain rules and regulations)",ghhoV3MlxEg,TEDxRosario 2011 - 16/09/11
