,Fecha_Publicación,Titulo,viewCount,likeCount,dislikeCount,commentCount,Duración_segs,Tags,Descripcion,videoID,Edicion
38,2018-07-25,Flipped Classroom: Invertir el aula es invertir en el futuro | Miguel Sedoff | TEDxRosario,30409,513,13,47,1042,"['TEDxTalks', 'Spanish', 'Education', 'Change', 'Childhood', 'Children', 'Classroom', 'Digital', 'Early education', 'Education reform', 'Future', 'Global issues', 'Innovation', 'Interface design', 'Learning', 'Local issues', 'Online video', 'Schools', 'Smartphone', 'Software', 'Students', 'Teaching', 'Youth']","Miguel nos cuenta los desafíos y aprendizajes de aplicar una nueva metodología de enseñanza en la provincia de Misiones: Flipped Classroom o Aula Invertida, donde la tecnología humaniza la educación.  Nació en Oberá, Misiones. Abogado, se dedicó a la educación desde lugares inesperados. Al principio en la legislación, después en la gestión y por último en el diseño y administración de políticas públicas educativas.
Diseñó y dirige Plataforma Guacurarí, el Programa de Innovación Educativa del Ministerio de Cultura, Educación, Ciencia y Tecnología de la provincia de Misiones y es uno de los pioneros de la aplicación de la metodología Flipped Classroom en América Latina. Por ello, la Flipped Learning Global Initiative lo ha incluido dentro del Top 40 Flipped Learning administrators and tech coaches worldwide.
Licenciatario del TEDxYouthPosadas, también le gusta escribir y ha publicado siete libros entre poesía, ficción, derecho y educación.
Es padre de cuatro hijos con la mujer de su vida.
Más que abogado, se considera un facilitador cultural que busca la mejora de las condiciones sociales y económicas de los jóvenes por medio de la educación. This talk was given at a TEDx event using the TED conference format but independently organized by a local community. Learn more at https://www.ted.com/tedx",LPMvx6hAElk,TEDxRosario 2017: Tiempo de lo inefable - 07/10/2017
39,2018-08-14,Si la tecnología es la respuesta ¿cuál es la pregunta? | Ximena Diaz Alarcon | TEDxRosario,7936,115,14,23,558,"['TEDxTalks', 'Spanish', 'Humanities', 'Advertising', 'Ancient world', 'Anthropology', 'Behavior', 'Comedy', 'Communication', 'Connection', 'Future', 'Happiness', 'History', 'Humor', 'Internet', 'Life', 'Marketing', 'Relationships', 'Technology']","Si la tecnología nos rodea y nos va a rodear mucho más, ¿cuál va a ser nuestro aporte al mundo? ¿Nos hacemos más humanos? ¿Más empáticos? ¿Más vulnerables? ¿Más sensibles?
En un contexto de cambio tan acelerado, muchas de las cosas que nos definían van perdiendo definición.
 Curiosa empedernida, le interesan mucho los seres humanos, desde la antigua Roma hasta los de ahora, los de acá, los de hace un ratito.
Por eso tiene un Master en Antropología social y política y creo junto a su socia, una empresa llamada Trendsity, que investiga para grandes empresas qué tendencias sociales, culturales y de consumo aparecen en América latina.
Está casada, tiene dos hijas hermosas y un gato del que, por más que lo intenta, nunca logra saber qué está pensando. This talk was given at a TEDx event using the TED conference format but independently organized by a local community. Learn more at https://www.ted.com/tedx",edk5y7cs7oI,TEDxRosario 2017: Tiempo de lo inefable - 07/10/2017
40,2019-03-27,Nina´s live set | Nina Vais | TEDxRosario,5224,87,2,8,853,"['TEDxTalks', 'No linguistic content', 'Entertainment', 'Music (performance)']","Nina Vais se presenta en vivo con un formato único que incluye violín eléctrico, canto, loopera, samplers, pedales de efectos y la combinación de varios estilos.  Nina Vais (alias Celeste Vasina) es violinista, productora musical, directora de orquesta, compositora y cantautora.
A los 19 años, una lesión en su codo izquierdo, la forzó a abandonar su carrera profesional como violinista. Fue en esa crisis cuando descubrió el fascinante mundo de la Composición y Producción. Esto la hizo resignificar su contacto con la música y cambiar la dirección de su carrera. Así es como entró en contacto con su verdadera pasión: la creación de su propio sonido y la ejecución en vivo de su propia música.
Hoy, gracias a la riqueza y diversidad de su formación y de su camino recorrido, puede crear un estilo musical único que consolida siglos de música y estilos. This talk was given at a TEDx event using the TED conference format but independently organized by a local community. Learn more at https://www.ted.com/tedx",BMp4jydkr7Q,TEDxRosario 2017: Tiempo de lo inefable - 07/10/2017
41,2018-09-16,TEDxRosario 2016: Pecados Capitales,318,4,0,0,130,"['tedx', 'tedxrosario', 'tedxrosario2016', 'teatro', 'teatro el circulo', 'rosario', 'santa fe', 'argentina', 'dario', 'dario z', 'dario sztajnszrajber', 'pecados capitales', 'charlas', 'buenos aires', 'tedxcordoba', 'tedxriodelaplata', 'javier yunes', 'julian dominguez', 'Kato Asato', 'Federico Ast', 'Rodrigo Azziani', 'Ramiro Fernandez', 'Guillermo Gebhart', 'Mirta Guelman', 'Juana Poulisis', 'Lucas Raspall', 'Martin Repetto', 'Patricio Romero', 'Josefina Scaglione', 'Gina Valenti', 'Alejandro Vila']","Preparativos previos y postales de lo que fue TEDxRosario 2016: Pecados Capitales
The making of and highlights of TEDxRosario 2016: Deadly Sins",Wevk6FfbIks,TEDxRosario 2016: Pecados Capitales - 19/11/2016
42,2017-01-10,Sobrevivir cuando sólo podés escoger entre dos malas movidas | Rodrigo Azziani | TEDxRosario,25479,650,14,33,612,"['TEDxTalks', 'Sindhi', 'Argentina', 'Life', 'Activism', 'Behavior', 'Career', 'Childhood', 'Community', 'Compassion', 'Cooperation', 'Crime', 'Drugs', 'Education', 'Education reform', 'Friendship', 'Games', 'Happiness', 'Hardship', 'Human Rights', 'Inequality', 'Learning', 'Life Development', 'Local issues', 'Parenting', 'Personal education', 'Personal growth', 'Poverty', 'Prison', 'Public Policy', 'Purpose', 'Relationships', 'Schools', 'Slum', 'Social Entrepreneurship', 'Social Interaction', 'Social Justice', 'Society', 'Sports', 'Struggle', 'Teaching', 'Violence', 'Volunteering', 'Work', 'Youth']","En esta conmovedora charla, Rodrigo utiliza el ajedrez para explicar como hay personas en la sociedad que quedan fuera del juego mucho antes de llegar al jaque mate.

Con una infancia barrial que lo acompaña, Roda se caracteriza por ser emprendedor, errante, esperanzado y tozudo. Afirma que fueron las puertas que se le presentaron y los referentes que lo entusiasmaron las claves para poder ser el joven de hoy.

Con 24 años es presidente de dos asociaciones – una cultural y otra deportiva - y coordina programas educativos que apuntan a ampliar los intereses y oportunidades de los niños.

Considera que el mundo se divide entre los que se quejan de las cosas que les molesta, y los que hacen algo para cambiarlas. Roda se queja de los que ocupan el primer grupo.

En un momento donde parecemos estar cada vez más separados, él se esfuerza por juntarnos.
Volver


This talk was given at a TEDx event using the TED conference format but independently organized by a local community. Learn more at http://ted.com/tedx",nVFc6iWk5b0,TEDxRosario 2016: Pecados Capitales - 19/11/2016
43,2017-01-17,Tu mente: el editor oculto del cuento de tu vida | Lucas Raspall | TEDxRosario,57245,1182,37,20,778,"['TEDxTalks', 'Spanish', 'Argentina', 'Social Science', 'Behavior', 'Biomechanics', 'Brain', 'Childhood', 'Children', 'Choice', 'Cognitive science', 'Connection', 'Consciousness', 'Decision making', 'Family', 'Fear', 'Happiness', 'Humor', 'Identity', 'Life', 'Life Development', 'Life Hack', 'Memory', 'Mental health', 'Motivation', 'Neurology', 'Neuroscience', 'Parenting', 'Personal growth', 'Philosophy', 'Positive Thinking', 'Psychology', 'Relationships', 'Self', 'Self improvement', 'Self-help', 'Social Interaction', 'Truth', 'Writing', 'Youth']","Lucas nos invita a releer el cuento que escribimos sobre nosotros mismos, sin darnos cuenta, desde el día en que nacemos. Y también nos anima a editar conscientemente las partes de éste que ya no nos sirven, o nos limitan sin necesidad.


A veces es médico, otras veces psiquiatra. Muchas veces es psicoterapeuta o acupuntor. Con mucho descaro es músico, pintor y, por qué no, escritor.

Es estudiante, profesor universitario y de posgrados, conferencista y divulgador. Es un espectador privilegiado de su propia mente e investigador incansable de sus laberintos.

Es experto en nada y confeso principiante en todo.

Es hijo, hermano y padre, por esto, es niño y adulto. Es marido de la mujer que ama y novio eterno de la vida.

En definitiva, es una persona: nada más.

This talk was given at a TEDx event using the TED conference format but independently organized by a local community. Learn more at http://ted.com/tedx",PbuVubgC8-c,TEDxRosario 2016: Pecados Capitales - 19/11/2016
44,2017-01-23,Tecno-pánicos ¿por qué tememos a lo nuevo? | Ramiro Fernandez | TEDxRosario,4967,68,1,3,675,"['TEDxTalks', 'Spanish', 'Argentina', 'Humanities', 'Ancient world', 'Anthropology', 'Archeaology', 'Change', 'Comedy', 'Computers', 'Connection', 'Culture', 'Curiosity', 'Entertainment', 'Fear', 'Future', 'Happiness', 'History', 'Humor', 'Innovation', 'Interface design', 'Invention', 'Marketing', 'Media', 'Personal education', 'Philosophy', 'Play', 'Product design', 'Progress', 'Simplicity', 'Social Media', 'Society', 'Technology']","Ramiro nos conduce por un divertidísimo recorrido histórico desde los iPads y tweets de la antigua Grecia, y a través de todos los miedos a las nuevas tecnologías que sufrió la humanidad.  ¿Por qué le tememos tanto al cambio?

Comenzó como periodista, pasó a Gerente de Contenidos, luego saltó al Desarrollo de Negocios para el área de New Media. Fundador de Lectorati y Cofundador de Lectoramas. Está casado con la mujer más maravillosa del mundo y tiene dos hijas a la que ama con locura. Y un gato que lo quiere pero que a veces lo muerde. Como la vida.

This talk was given at a TEDx event using the TED conference format but independently organized by a local community. Learn more at http://ted.com/tedx",lMhxxv8pPYA,TEDxRosario 2016: Pecados Capitales - 19/11/2016
45,2017-01-31,Los 7 pecados vitales de la creatividad | Damian Kato Asato | TEDxRosario,16892,299,15,15,750,"['TEDxTalks', 'Spanish', 'Argentina', 'Life', 'Advertising', 'Behavior', 'Career', 'Change', 'Choice', 'Creation', 'Creativity', 'Death', 'Fear', 'Happiness', 'Hardship', 'Ideas', 'Innovation', 'Life Development', 'Life Hack', 'Marketing', 'Motivation', 'Personal growth', 'Philosophy', 'Play', 'Positive Thinking', 'Psychology', 'Purpose', 'Relationships', 'Self', 'Self improvement', 'Self-help', 'Sharing', 'Success', 'Teaching', 'Travel', 'Violence']","En un mundo donde ya todo parece estar creado, Kato nos ayuda a redefinir la creatividad y nos comparte 7 técnicas que aprendió a lo largo de su vida, que todos podemos usar si nos atrevemos.
¿Puede la creatividad ayudarnos a vivir mejor? 

Kato Asato es director de la Escuela Superior de Creativos Publicitarios. Donde en 2008 materializó un sistema de enseñanza online para llegar a todo el mundo en tiempo real, y de esa manera optimizar la enseñanza y borrar fronteras.
Al terminar la colimba (le tocó el servicio militar) dio los exámenes de ingreso al ISER para ser operador de sonido en TV, como los dió mal terminó estudiando Relaciones Públicas en la UADE.
En el último año tuvo publicidad como materia, lo que lo llevó a estudiar creatividad en la escuelita de creativos que hoy dirige.
Trabajó como creativo publicitario en agencias de Argentina, México y Ecuador. País donde también formó parte del equipo de campaña presidencial para Rafael Correa.
El dirigir la escuela de creativos lo llevó a convertirse en asesor externo de agencias en latinoamérica. Y el que sea una sede online, a emprender nuevos negocios digitales como un Centro de Exposiciones Online y un periódico virtual para empresas.

This talk was given at a TEDx event using the TED conference format but independently organized by a local community. Learn more at http://ted.com/tedx",OW3Hdkz5AOU,TEDxRosario 2016: Pecados Capitales - 19/11/2016
46,2017-02-13,Las bacterias y la soberbia humana | Alejandro Vila | TEDxRosario,8883,169,3,9,769,"['TEDxTalks', 'Spanish', 'Argentina', 'Health', 'Bacteria', 'Behavior', 'Big problems', 'Biology', 'Body', 'Community', 'Death', 'Disease', 'Drugs', 'Epidemiology', 'Evolution', 'Exposure', 'Family', 'Genetics', 'Global issues', 'History', 'Illness', 'Medicine', 'Microbiology', 'Natural disaster', 'Nature', 'Pandemic', 'Public health', 'Research', 'Science', 'Social Change', 'Sustainability']","El problema número uno de la humanidad no es ni la superpoblación, ni los tsunamis, ni el cambio climático, ni quién nos gobierne. Alejandro estudia las superbacterias, organismos que surgen por un pobre uso de las herramientas que tenemos para defendernos de ellos y que podrían matar millones de vidas en un instante. 

Quiso ser escritor y músico, pero terminó estudiando química y es investigador en el Instituto de Biología Molecular y Celular de Rosario (IBR-CONICET). Con el tiempo se dio cuenta de que ambas eran distintas maneras de hacer cosas creativas, desafiantes y divertidas.

This talk was given at a TEDx event using the TED conference format but independently organized by a local community. Learn more at http://ted.com/tedx",UY701VegRQc,TEDxRosario 2016: Pecados Capitales - 19/11/2016
47,2017-02-21,Las ventajas de vivir en Estado Niño | Patricio Romero | TEDxRosario,10427,210,10,7,884,"['TEDxTalks', 'Spanish', 'Argentina', 'Humanities', 'Achievement', 'Advertising', 'Behavior', 'Business', 'Career', 'Childhood', 'Children', 'Comedy', 'Communication', 'Creativity', 'Dance (performance)', 'Entertainment', 'Entrepreneurship', 'Failure', 'Fear', 'Friendship', 'Happiness', 'Humor', 'Identity', 'Life Development', 'Marketing', 'Motivation', 'Music (performance)', 'Personal growth', 'Play', 'Self', 'Start-up', 'Success', 'Work']","Son muchas las cosas que Patricio Romero aprendió de niño, pero algo que no aprendió fue a quedarse sentado quieto.
En esta inusual y entretenida charla Pato nos cuenta la directiva que lo guió en sus sucesivos emprendimientos, desde traer el sushi a Rosario con Sr Ming hasta organizar los paseos a los perros de la ciudad, hay que amigarse con la vergüenza y nunca perder la frescura.

Emprendedor serial, fanático de las ideas por más locas que parezcan y no descansa hasta probarlas en la vida real.
Estudio Ing. en sistemas, bellas artes, astronomía, Lic. en quimica, museología y es profesor de artes marciales.
Ama la ciencia y a la gente con buen onda.
Tuvo una cadena muy exitosa de sushi (Sr Ming), una empresa de desarrollo de diseño web creativo (fucking Rats) con clientes internacionales de renombre, restaurantes de comida rapida (ming fat food), local de jugueteria con juguetes no tradicionales (corre que te azoto),co-fundador de un marketplace de fotos de instagram (dotspin) donde el fundador de wikipedia nos contacto para ser parte del proyecto. Actualmente es fundador y board member de Whyline y Paseaperros.com. La 1era. es una app que permitirá eliminar las filas de espera globalmente y 2da. es actualmente la plataforma líder en Argentina en cantidad de paseadores de perros y contrataciones para el cuidado de mascotas.

This talk was given at a TEDx event using the TED conference format but independently organized by a local community. Learn more at http://ted.com/tedx",XXX0MvPDXyQ,TEDxRosario 2016: Pecados Capitales - 19/11/2016
48,2017-03-22,Una moto eléctrica que vas a desear | Guillermo Gebhart | TEDxRosario,55546,1374,45,147,447,"['TEDxTalks', 'Spanish', 'Argentina', 'Technology', 'Alternative energy', 'Climate Change', 'Electricity', 'Energy', 'Engineering', 'Entrepreneurship', 'Future', 'Green', 'Industrial design', 'Innovation', 'Interface design', 'Invention', 'Investment', 'Mobility', 'Product design', 'Start-up', 'Sustainability', 'Transportation']","Los vehículos eléctricos están haciendo mucho ruido en el mundo. Y ¿dónde estamos nosotros como país en este panorama? Guillermo nos viene a contar de su sueño de poner a Entre Ríos en el plano mundial de la movilidad eléctrica con su hermosa moto de alto desempeño. 

Fundador de Voltu y docente de Robótica en la Facultad de Ingeniería de la Universidad Nacional de Entre Ríos.
Es Bioingeniero y en camino a doctorarse en Ingeniería. Ganó premios por sus trabajos en Interfaces Cerebro Computadora y Robótica.
Desde chico tuvo múltiples trabajos en todas las áreas. Desde sereno hasta CEO de su propia empresa.
En los últimos años se dedicó a fundar una compañía desde la nada. Invirtiendo, consiguiendo inversionistas y socios, desarrollando tecnología de vanguardia, gestionando un equipo multidisciplinario y asegurando resultados con los mínimos recursos posibles.

This talk was given at a TEDx event using the TED conference format but independently organized by a local community. Learn more at http://ted.com/tedx",M77Ef7WXHmk,TEDxRosario 2016: Pecados Capitales - 19/11/2016
49,2017-04-07,Sexualidad vs genitalidad: Amar a cuerpo entero | Mirta Guelman | TEDxRosario,72402,1006,64,35,693,"['TEDxTalks', 'Spanish', 'Argentina', 'Humanities', 'Behavior', 'Behavorial economics', 'Body', 'Body language', 'Childhood', 'Children', 'Cognitive science', 'Connection', 'Culture', 'Depression', 'Early education', 'Education', 'Education reform', 'Emotions', 'Evolution', 'Friendship', 'Gender', 'Health', 'Life Development', 'Love', 'Men', 'Personal education', 'Personal growth', 'Psychology', 'Relationships', 'Romance', 'Sex', 'Social Change']","En la era de las relaciones fugaces y digitales, cuando todos los estímulos conspiran para que nos inunden los deseos y las necesidades, Mirta nos invita a descubrir que nuestro cerebro da para mucho más a la hora de amar. 

Mirta es pediatra y lleva 50 años lidiando con padres, docentes, políticos, legisladores, jueces, médicos, psicopedagogos y sobretodo supuestos ex-pertos y académicos, para defender a quienes están creciendo e intentan ser humanos enteros.

This talk was given at a TEDx event using the TED conference format but independently organized by a local community. Learn more at http://ted.com/tedx",Xc1asyb1wpk,TEDxRosario 2016: Pecados Capitales - 19/11/2016
50,2017-04-07,Cuando lo saludable no te deja vivir | Juana Poulisis | TEDxRosario,44970,960,63,91,554,"['TEDxTalks', 'Spanish', 'Argentina', 'Health', 'Behavior', 'Body', 'Brain', 'Culture', 'Depression', 'Food', 'Illness', 'Life', 'Life Hack', 'Mental health', 'Neurology', 'Nutrition', 'Obesity', 'Self-help']","Todos somos propensos a algún vicio. Pero ¿qué pasa cuando este vicio nace como algo saludable, bajamos nuestras defensas y se convierte en un exceso? Juana nos introduce al mundo de la ortorexia, o la obsesión patológica por comer ""saludablemente"". 

Médica psiquiatra, Magister en Psicofarmacología, presidente del capítulo Internacional Fundación IAEDP, docente y conferencista.
Su primer trabajo fue en el área de los trastornos de la conducta alimentaria, el cual ayudó a erradicar de su vida la palabra dieta, comenzando el significado de su ser profesional.
Luego de especializarse en el exterior, continuó con su trabajo ayudando a los adolescentes a encontrar valores más allá de la estética y la dieta.
Le apasiona el funcionamiento del cerebro, entender el por qué comemos y por qué no, por qué nos gusta el chocolate y no tanto el apio y cómo un paciente puede llegar a rechazar los alimentos hasta el punto de la desnutrición y muerte.
Cree que debemos cooperar con la salud, a ello le ha dedicado su formación, las clases, las conferencias y hasta un libro, siendo este el camino, en que Juana procura ir por la vida.

This talk was given at a TEDx event using the TED conference format but independently organized by a local community. Learn more at http://ted.com/tedx",zQz6Oxc9avo,TEDxRosario 2016: Pecados Capitales - 19/11/2016
51,2017-10-03,Cómo Broadway me ayudó a reencontrarme | Josefina Scaglione | TEDxRosario,7682,186,1,4,871,"['TEDxTalks', 'Spanish', 'Life', 'Achievement', 'Art', 'Arts education', 'Career', 'Decision making', 'Emotions', 'Entertainment', 'Exposure', 'Fear', 'Happiness', 'Identity', 'Life Development', 'Passion', 'Song']","Entre arias y canciones pop, Josefina nos enfatiza la importancia de no perder de vista la propia esencia, aun en los momentos donde uno parecería tocar el cielo con las manos.  Josefina es cantante, actriz y cantautora. Es una artista en expansión con una incesante búsqueda de la honestidad expresiva.

Conocida principalmente por ser la primera argentina en Broadway y su magnífica interpretación de “Maria” en West Side Story que le valió una Nominación a los Premios TONY. También distinguida con los Premios Theater World Award y Outer Critics Circle of New York y un Grammy Award al Mejor Cast Album.

Josefina ha pisado escenarios nacionales e internacionales, pasando también por la TV y el Cine. Actualmente, da a conocer su faceta como cantautora en su proyecto musical PsicoPicnic. This talk was given at a TEDx event using the TED conference format but independently organized by a local community. Learn more at https://www.ted.com/tedx",Z-yZogLNRB8,TEDxRosario 2016: Pecados Capitales - 19/11/2016
52,2017-04-07,"Vidas cruzadas, vidas salvadas | Ariel Kaplan | TEDxRosario",1382,13,5,0,461,"['TEDxTalks', 'Spanish', 'Argentina', 'Health', 'Big Data', 'Big problems', 'Cooperation', 'Illness', 'Initiative', 'Law', 'Public health', 'Social Change', 'Society', 'Surgery']","Ariel nos llama la atención sobre una propuesta tan importante como urgente: La donación cruzada de órganos. Alternativa a la donación cadavérica que puede salvar miles de vidas de argentinos y que debemos comenzar a discutir. 

“Resilience personality”, término que escuchó por primera vez en una evaluación de desempeño 10 años atrás en una empresa multinacional para la que trabajó. Sin entenderlo en su momento, al procesarlo con el tiempo, se dió cuenta que puede ser un adjetivo o atributo obtuso, derivado de una herencia de fuertes mandatos familiares, que confluyeron en una querida neurosis obsesiva o bien de una gran pasión por hacer las cosas.
Siempre se quiso convencer de la segunda opción.

Cualquiera sea el caso, hasta aquí por ahora lo trajo la vida, con su hermosa y queridísima hija y una esposa invalorable. Orgulloso egresado del Colegio Superior de Comercio, de la Facultad de Ciencias Económicas de la UNR y de una Maestría en Finanzas del Cema.

Actualmente COO para LATAM de una empresa multinacional de salud.

This talk was given at a TEDx event using the TED conference format but independently organized by a local community. Learn more at http://ted.com/tedx",LlJLvAZC8UE,TEDxRosario 2016: Pecados Capitales - 19/11/2016
53,2017-05-11,"Crowdjury, la justicia del futuro | Federico Ast | TEDxRosario",3151,65,4,2,633,"['TEDxTalks', 'Spanish', 'Argentina', 'Technology', 'Big problems', 'Computers', 'Crime', 'Entrepreneurship', 'Future', 'Global issues', 'Globalization', 'Goal-setting', 'History', 'Innovation', 'Internet', 'Law', 'Open-source', 'Social Change', 'Social Entrepreneurship', 'Social Interaction', 'Social Justice', 'Start-up']","¿El sistema judicial es obsoleto? Federico nos cuenta cómo se resolvían los conflictos legales en la antigüedad y cuales son las dificultades que surgen en la actualidad que no se pueden resolver con la justicia tal como la conocemos. 

Federico es graduado en economía y en filosofía por la Universidad de Buenos Aires.

Es emprendedor en tecnología.

Es candidato a Doctor en Dirección de Empresas en IAE Business School.

Estudia fenómenos de innovación disruptiva, inteligencia colectiva, crowdsourcing, bitcoin y las tecnologías p2p.
Escribe habitualmente sobre innovación en medios como Clarín y Globo.
Es profesor de creación de empresas en UCEMA y consultor en negocios digitales e innovación.

Es fundador y CEO de Crowdjury, el primer sistema de justicia para la era de Internet.

This talk was given at a TEDx event using the TED conference format but independently organized by a local community. Learn more at http://ted.com/tedx",WLaRGv4nPE4,TEDxRosario 2016: Pecados Capitales - 19/11/2016
