,Fecha_Publicación,Titulo,viewCount,likeCount,dislikeCount,commentCount,Duración_segs,Tags,Descripcion,videoID,Edicion
0,2019-10-07,TEDxRosario 2019: A la décima potencia,3833,90,0,7,206,"['tedxrosario', 'tedx', 'rosario', 'argentina', 'santa fe', 'destacado', 'tedxlabs', 'drones', 'planetario', 'parque urquiza', 'anfiteatro', 'nico ilustraciones', 'cecilia ce', 'juan castro', 'alberto rojo', 'javier yunes', 'julian dominguez', 'tedx argentina', 'tedx rosario', 'javier artigas']","Momentos de TEDxRosario 2019: A la décima potencia, realizado el 5 de octubre del 2019 en el Anfiteatro municipal Humberto de Nito con 7500 asistentes",ilC6WOT9xEE,TEDxRosario 2019: A la décima potencia - 05/08/2019
1,2019-11-22,La ecuación del sexo | Cecilia Ce | TEDxRosario,635705,20604,537,413,883,"['TEDxTalks', 'Spanish', 'Life', 'Humanity', 'Humor', 'Life Development', 'Sex', 'Sexual Orientation']","¿Cómo se llega al orgasmo? ¿Se puede medir el sexo? ¿Cuántas veces tuviste relaciones esta semana? Cecilia nos comparte una fórmula para tener mejor sexo.  Estudió psicología creyendo que no iba a hacer consultorio y hoy lleva diez años atendiendo pacientes. Trabajó con adictos muchos años, hasta que se animó a seguir su verdadera pasión y se formó como sexóloga. Su búsqueda es promover una sexualidad libre, empática, informada y descontracturada. This talk was given at a TEDx event using the TED conference format but independently organized by a local community. Learn more at https://www.ted.com/tedx",WZVOLmUNBzM,TEDxRosario 2019: A la décima potencia - 05/08/2019
2,2019-12-02,La edición genética aplicada para un mundo sustentable | Gustavo Schujman | TEDxRosario,720,18,2,0,692,"['TEDxTalks', 'Spanish', 'Science', 'Biotech', 'Environment', 'Global issues', 'Recycling', 'Technology']","Gustavo nos cuenta sobre la tecnología que han desarrollado para producir plástico biodegradable y otros materiales amigables con el medioambiente, a partir de residuos industriales, por medio de bacterias modificadas genéticamente. En el país, estudió Bioquímica, se desempeñó como docente y obtuvo un doctorado en Ciencias Biológicas. En el extranjero, investigó en el Instituto Tecnológico de Massachussets y en el Instituto Pasteur de París. Actualmente, es socio fundador y Gerente de INMET, empresa dedicada a la transformación de residuos agroindustriales en moléculas de mayor valor agregado. Pese a todos estos logros, dicen que donde mejor se destaca es en la parrilla. This talk was given at a TEDx event using the TED conference format but independently organized by a local community. Learn more at https://www.ted.com/tedx",sbqvcXs3otI,TEDxRosario 2019: A la décima potencia - 05/08/2019
3,2019-12-02,La innovación como clave para educar en contextos vulnerables | María Cristina Gomez | TEDxRosario,1294,57,0,0,935,"['TEDxTalks', 'Spanish', 'Education', 'Education reform', 'Innovation', 'Poverty', 'Social Change', 'Social Justice']","Maria Cristina nos desafía a dejar de lado la  ""pedagogía de la lástima"" y brindar los mejores recursos a estudiantes que están en contextos de vulnerabilidad socio económica. Fue elegida como una de los 50 mejores maestras del mundo, por el Global Teacher Prize por su trabajo como educadora y diseñando programas educativos innovadores. Fundó la Red de Educadores Innovadores, desde Rosario para el mundo. This talk was given at a TEDx event using the TED conference format but independently organized by a local community. Learn more at https://www.ted.com/tedx",iSAiMn1_d5k,TEDxRosario 2019: A la décima potencia - 05/08/2019
4,2020-03-03,Arte con microorganismos: la belleza de un mundo invisible | Luciana Paoletti | TEDxRosario,636,23,0,1,629,"['TEDxTalks', 'Spanish', 'Art', 'Bacteria', 'Microbiology', 'Photography', 'Science']","Luciana nos lleva a un viaje a través del invisible pero potencialmente hermoso mundo de la micro-biología, en una combinación asombrosa de arte y ciencia que nos deja pensando en la huella literal que dejamos en el mundo.  Biotecnóloga, Doctora en Ciencias Biológicas, docente en el área de Microbiología y además, artista visual. Como científica trabajó en diferentes temáticas, actualmente en la producción de enzimas de uso industrial y biogás. Como artista, estudia su entorno cercano. La fusión constante entre lo objetivo y lo subjetivo en estos proyectos genera resultados pertenecientes al campo artístico, que simultáneamente quedan excluidos del científico. This talk was given at a TEDx event using the TED conference format but independently organized by a local community. Learn more at https://www.ted.com/tedx",ZdFk_R5cp6c,TEDxRosario 2019: A la décima potencia - 05/08/2019
5,2020-03-03,Protagonista de una cadena de milagros | Javier Artigas Herrera | TEDxRosario,3143,76,0,4,1248,"['TEDxTalks', 'Spanish', 'Life', 'Entrepreneurship', 'Health', 'Illness', 'Struggle', 'Travel']","Javier nos cuenta una verdadera historia de película, de cómo su emprendimiento, que nació de la necesidad personal, hoy permite a cientos de miles de personas enfermas viajar tranquilas por el mundo. En una cadena de milagros de la que es protagonista involuntario, a Javier le diagnostican una enfermedad, crea su empresa, le salva la vida al escritor Hernán Casciari y recibe en su casa de Uruguay al fundador de AirBNB, todo mientras escala su startup a una multinacional en más de 150 países. Una historia tan increíble, que Disney decidió convertirla en la primera película de Hollywood sobre una startup latinoamericana. Protagonista involuntario de una cadena de milagros, ha pasado de estar en coma y perder su empleo a salvarle la vida a Hernán Casciari, ser anfitrión del fundador de Airbnb en su casa en Montevideo y liderar una startup con presencia en más de 150 países. En el medio recibió un trasplante de riñón y ahora intenta, a través de su empresa Connectus Medical, darle una vida mejor a pacientes de diálisis de todo el mundo. This talk was given at a TEDx event using the TED conference format but independently organized by a local community. Learn more at https://www.ted.com/tedx",Q51BcsYh1vQ,TEDxRosario 2019: A la décima potencia - 05/08/2019
6,2020-01-21,Deconstruyendo el concepto de belleza | Candela Yatche | TEDxRosario,28555,1647,32,90,755,"['TEDxTalks', 'Spanish', 'Humanities', 'Body', 'Mental health', 'Self', 'Self-help', 'Social Change', 'Social Interaction']","Candela nos invita a reflexionar sobre cómo la belleza es una construcción social y la tarea que día a día tenemos que hacer para potenciar la  auto aceptación, inmersos en una sociedad más preocupada por vender que por cuidar de nuestro bienestar.
Nos cuenta sobre Bellamente (www.bellamente.com.ar), un proyecto social que propone un espacio de diálogo real y virtual para repensar los estereotipos de belleza y aprender a querernos como somos. Trabaja para inspirar a las personas a conectar con lo mejor de sí mismos, para eso estudia psicología, dirige el proyecto social Bellamente, organiza festivales, dicta cursos en varias provincias del país y hasta escribió una novela. Es una incansable militante de la autoaceptación de 22 años. This talk was given at a TEDx event using the TED conference format but independently organized by a local community. Learn more at https://www.ted.com/tedx",ru77Omox_UE,TEDxRosario 2019: A la décima potencia - 05/08/2019
7,2020-02-24,Crisis climática VS Intereses económicos | Nazareno Castillo Marin | TEDxRosario,1542,65,1,2,835,"['TEDxTalks', 'Spanish', 'Global Issues', 'Climate Change', 'Economics', 'Global issues', 'Policy', 'Pollution', 'Social Change']","En un mundo al borde de una crisis climática, Nazareno nos advierte que debemos dejar de esperar que otros la resuelvan. Nos cuenta de forma muy clara lo que ocurre dentro de las negociaciones internacionales, como el Acuerdo de París, y por qué es importante que comencemos a escuchar a nuestro amigo ecologista. Biólogo que desde sus inicios se interesó por el calentamiento global. Fue así como comenzó su carrera en la Secretaría de Ambiente de la Nación, donde ocupó el cargo de Director de Cambio Climático durante siete años, negociando por el país en la Convención de Naciones Unidas y coordinando el equipo que preparó la primera contribución que presentó la Argentina en el marco del Acuerdo de París. This talk was given at a TEDx event using the TED conference format but independently organized by a local community. Learn more at https://www.ted.com/tedx",3lV9jg1WQTA,TEDxRosario 2019: A la décima potencia - 05/08/2019
8,2020-01-14,"¿Cuánto tiempo es un ""tiempito"" cuando hablamos de adopción? | Marcelo Molina | TEDxRosario",3056,76,1,2,941,"['TEDxTalks', 'Spanish', 'Social Sciences', 'Childhood', 'Children', 'Law', 'Life', 'Social Justice', 'Society']","Marcelo, a partir de una obra teatral que aborda la problemática de adopción y es protagonizada por jueces, camaristas, ex magistrados y empleados de los Tribunales, nos desafía a repensar los procesos judiciales, y los propios, desde los tiempos de las personas más vulnerables en nuestra sociedad: los niños y las niñas. Fue juez de familia en su Rosario natal durante casi diez años y es docente de esa materia en la Universidad Nacional de Rosario. Hace tres años escribió un libro que relata brevemente historias vividas en su juzgado y que hoy se transformó en obra de teatro: ""¿Cuánto tiempo es un tiempito?"", que protagonizan jueces, secretarias, empleados y empleadas judiciales y un grupo de adolescentes. This talk was given at a TEDx event using the TED conference format but independently organized by a local community. Learn more at https://www.ted.com/tedx",eZzrA4GOOJg,TEDxRosario 2019: A la décima potencia - 05/08/2019
9,2020-03-24,La igualdad empieza en el lenguaje | Juan Bonnin | TEDxRosario,4891,151,14,19,561,"['TEDxTalks', 'Spanish', 'Social Sciences', 'Communication', 'Empathy', 'Language', 'Linguistics', 'Medicine', 'Writing']","A través de algunas historias, Juan nos muestra qué pasa cuando la comunicación falla sin querer. Nos invita a pensar críticamente como evitar esos desencuentros para incluir a través del lenguaje. Lingüista, investigador y docente. De chico quería ser ingeniero agrónomo, pero no podía dejar de leer literatura en las clases de biología. Investiga la lengua en el CONICET y enseña a investigar en la Universidad Nacional de San Martín. Estudia para entender cómo el lenguaje afecta nuestra manera de ver y actuar en el mundo, cómo puede facilitar u obstaculizar el acceso a derechos y sobre todo, cómo podemos hacer para mejorar esa situación. This talk was given at a TEDx event using the TED conference format but independently organized by a local community. Learn more at https://www.ted.com/tedx",pmymU199a-w,TEDxRosario 2019: A la décima potencia - 05/08/2019
10,2020-03-24,Reflejos ilustrados de la vida cotidiana | Nicolas Vilela | TEDxRosario,2519,145,1,8,611,"['TEDxTalks', 'Spanish', 'Art', 'Activism', 'Beauty', 'Cartoon', 'Comedy', 'Empathy']","Nico Ilustraciones a través de sus dibujos ayuda a más de un millón de personas a comunicar lo que sienten, cuando la simpleza de lo cotidiano despierta emociones difíciles de expresar. Dibujante, humorista gráfico. Ilustra situaciones cotidianas, simples, que nos pasan todos los días. Su mirada nos llega al alma y nos roba una sonrisa. Más de un millón de personas lo siguen en instagram. @nicoilustraciones This talk was given at a TEDx event using the TED conference format but independently organized by a local community. Learn more at https://www.ted.com/tedx",1odz43Xvsqw,TEDxRosario 2019: A la décima potencia - 05/08/2019
11,2020-04-29,One simple trick to reclaim your power | Kasia Urbaniak | TEDxRosario,167421,2048,68,59,1237,"['TEDxTalks', 'English', 'Global Issues', 'Communication', 'Connection', 'Gender', 'Leadership', 'Women', 'Women in business']","Throughout centuries, women have been trained to give up their power. With a simple communicational hack, they can reclaim their power when facing gender inequality, no matter the stakes. But the question is, why do women freeze in the first place? In this provocative and insightful talk, Kasia Urbaniak explores the effects of cultural conditioning and the difference between power and gender dynamics, while teaching us to change the way we have conversations as a society, so both women and men can reach their full potential as human beings. 

Kasia Urbaniak spent 17 years studying to become a Taoist nun. To foot the bill for her studies, she worked as a high-paid (and extremely successful) dominatrix in dungeons around New York City. What she learned in these two wildly different settings has turned into her life’s work, teaching women about power dynamics and influence to become better leaders. Her mission: to redefine what it means to be a good girl.

This talk was given at a TEDx event using the TED conference format but independently organized by a local community. Learn more at https://www.ted.com/tedx",9W1_vUiMC6E,TEDxRosario 2019: A la décima potencia - 05/08/2019
12,2020-05-13,El fruto de transformar a la ciencia en empresas | Matías Viel | TEDxRosario,1084,31,2,5,919,"['TEDxTalks', 'Spanish', 'Business', 'Bees', 'Entrepreneurship', 'Food', 'Productivity', 'Science', 'Technology']","Matias nos cuenta su experiencia como emprendedor. De cuando se sumergió en el mundo de la ciencia para aprender sobre las abejas. Y de la creación de una empresa, Beeflow, que busca mejorar la eficiencia en la producción de alimentos a nivel global.  Cuando era chico, soñaba con participar de un Juego Olímpico. Sin embargo, estudió Administración de Empresas y conoció su nueva pasión: los emprendimientos. Actualmente vive en California, hogar del mercado más grande de frutas y verduras, donde busca convertir a su nuevo emprendimiento, Beeflow, en la empresa global líder en la polinización de cultivos. This talk was given at a TEDx event using the TED conference format but independently organized by a local community. Learn more at https://www.ted.com/tedx",1ONOnahpouI,TEDxRosario 2019: A la décima potencia - 05/08/2019
13,2018-12-13,TEDxRosario 2018: Al límite de la ignorancia,1927,29,0,1,188,"['tedx', 'tedxrosario', 'tedxrosario2018', 'al limite de la ignorancia', 'anfiteatro', 'humberto de nito', 'parque', 'urquiza', 'rosaio', 'santa fe', 'argentina', 'rio', 'parana', 'drones', 'dron', 'aerea', 'evento', 'ideas', 'charlas', 'osde', 'macro', 'municipalidad']","Preparativos previos y postales de lo que fue TEDxRosario 2018: Al límite de la ignorancia.
The making of and highlights of TEDxRosario 2018: To the limits of ignorance",AQCE-ZD_j-g,TEDxRosario 2018: Al límite de la ignorancia - 06/10/2018
14,2018-11-02,El cerrajero que tiene la llave del cielo | Víctor Buso | TEDxRosario,5763,210,6,13,741,"['TEDxTalks', 'Spanish', 'Science (hard)', 'Astronomy', 'Globalization', 'Life', 'Passion', 'Purpose', 'Research', 'Volunteering']","Victor tiene una doble vida. De día es cerrajero, pero de noche sube al techo de su casa y observa las estrellas desde un observatorio que construyó motivado por su pasión: La astronomía. Y en 2016 observo algo que nadie en la historia de la humanidad había logrado observar.  Cerrajero durante el día, y astrónomo aficionado durante la noche. Víctor es la primera persona en la historia de la humanidad en fotografiar el nacimiento de una supernova - un suceso ocurrido hace 70 millones de años en el universo - y lo hizo desde el observatorio casero que tiene en el techo de su casa.

Tiene 58 años, es esposo de Viviana y padre de Camila. Trabajador, soñador, desde chico le gustaron los telescopios y se maravilló por el mundo de la astronomía, en cuya historia entró el 20 de septiembre de 2016 observando el cielo. This talk was given at a TEDx event using the TED conference format but independently organized by a local community. Learn more at https://www.ted.com/tedx",gPGZvevaAaw,TEDxRosario 2018: Al límite de la ignorancia - 06/10/2018
15,2018-12-06,Conversación sobre astrología y ciencia | Alberto Rojo | TEDxRosario,24936,683,185,326,1045,"['TEDxTalks', 'Spanish', 'Science (hard)', 'Astronomy', 'Life', 'Pseudoscience', 'Psychology', 'Science']","A través de una conversación con Margarita, su maquilladora, Alberto ahonda en los límites de la astrología, sus diferencias con el pensamiento científico y la importancia de distinguir entre ambas a la hora de tomar decisiones en nuestras vidas.  Licenciado y doctor en física por el Instituto Balseiro, es profesor titular del Departamento de Física de la Universidad de Oakland, en Michigan. Especialista en física cuántica del estado sólido, publicó en coautoría con Anthony Leggett (premio Nobel de Física de 2003). En 2018 publicó The Principle of Least Action (Cambridge University Press), el cuarto libro de una de sus pasiones: la divulgación científica. Creó y condujo la serie “Artistas de la Ciencia”, emitida en Canal Encuentro. Como guitarrista publicó cuatro álbumes y acompañó a Mercedes Sosa en numerosas salas del mundo. En 2006 debutó como orquestador en el Teatro Colón de Buenos Aires con la obra Ni Si Ni No. Compuso a dúo con Pedro Aznar, Luis Gurevich, Víctor Heredia, Luis Pescetti. Entre sus distinciones fuguran el Fulbright Specialist , la Silla Dotal, Jack Williamson Professor of Science and Humanities por la Universidad del Este de New Mexico. En 2012 fue nombrado Ciudadano Ilustre de la Provincia de Tucumán. This talk was given at a TEDx event using the TED conference format but independently organized by a local community. Learn more at https://www.ted.com/tedx",i2Q2dZSXHEc,TEDxRosario 2018: Al límite de la ignorancia - 06/10/2018
16,2018-12-05,El valor de la frustración en la educación de los hijos | Alejandro De Barbieri | TEDxRosario,54561,1097,45,20,646,"['TEDxTalks', 'Spanish', 'Humanities', 'Behavior', 'Education', 'Family', 'Life', 'Life Development', 'Love', 'Parenting', 'Psychology', 'Relationships', 'Social Interaction', 'Society']","Alejandro nos muestra con humor cual es la diferencia entre educar en la sociedad de la abundancia y educar en la sociedad de la escasez. Y cómo la frustración es fundamental para ayudar a nuestros hijos a enfrentar mejor el mañana.  Alejandro siempre soñó con ayudar a los demás. Le gustaba mucho leer y quería ser escritor pero un profesor de filosofía lo descubrió copiando en un examen y tuvo que estudiar tanto para el próximo que se hizo psicólogo. Después de 20 años de trabajo clínico y educacional publicó su libro “Economía y Felicidad“; un amigo lo llevó a la radio y desde entonces no para de comunicar, de acercar la psicología a la gente, dedicándose a la prevención y promoción de salud y de vínculos saludables en la familia, las organizaciones y la sociedad.

Uruguayo, nacido en Rocha, casado con Marcela es padre de dos hijas, Martina y María Belén, hincha de Peñarol y fanático de la dupla Messi Suarez! This talk was given at a TEDx event using the TED conference format but independently organized by a local community. Learn more at https://www.ted.com/tedx",W_54PSFKztg,TEDxRosario 2018: Al límite de la ignorancia - 06/10/2018
17,2018-12-19,De Estonia a Argentina: el fin de la burocracia en los gobiernos | Gustavo Giorgetti | TEDxRosario,5490,157,4,5,903,"['TEDxTalks', 'Spanish', 'Technology', 'Big Data', 'Big problems', 'Data', 'Developing World', 'Development', 'Future', 'Global issues', 'Globalization', 'Government']","Gustavo, inspirado por el modelo de Estonia, buscó aplicar los mismos principios de digitalización en su provincia de Neuquén. Nos cuenta en qué consiste la verdadera transformación digital y por qué este modelo es superior a todos los demás. Ingeniero, innovador, autodidacta de todo lo que no le enseñaron, que no para hasta lograr articular todo lo que puede sumar. Esto lo ha llevado a hacer, desde puentes sobre un río hasta puentes entre las ideas y paradigmas. Así creó una empresa llamada ThinkNet (pensar en red) para abordar los cambios complejos donde confluyen; diversidad de actores, intereses, teorías, tecnologías, logrando realizar transformaciones exitosas.

Vive en Neuquén con Mónica su esposa y compañera que lo banca en todas sus locuras, tiene 4 hijos, 2 nietos y una más en camino.

Ingeniero, innovador, autodidacta de todo lo que no le enseñaron, que no para hasta lograr articular todo lo que puede sumar. Esto lo ha llevado a hacer, desde puentes sobre un río hasta puentes entre las ideas y paradigmas. Así creó una empresa llamada ThinkNet (pensar en red) para abordar los cambios complejos donde confluyen; diversidad de actores, intereses, teorías, tecnologías, logrando realizar transformaciones exitosas.

Vive en Neuquén con Mónica su esposa y compañera que lo banca en todas sus locuras, tiene 4 hijos, 2 nietos y una más en camino. This talk was given at a TEDx event using the TED conference format but independently organized by a local community. Learn more at https://www.ted.com/tedx",trho43UbZ6Y,TEDxRosario 2018: Al límite de la ignorancia - 06/10/2018
18,2018-12-21,El periodismo será humano o no será | Juan Mascardi | TEDxRosario,2697,82,1,0,1056,"['TEDxTalks', 'Spanish', 'Humanities', 'Activism', 'Behavior', 'Compassion', 'Hardship', 'Journalism', 'Life', 'Media', 'Social Change', 'Tragedy', 'Truth', 'TV', 'Violence', 'Writing']","Juan nos narra a través de historias cómo fue que entendió que el periodismo puede y debe ser mucho más que el relato de los hechos. La tragedia de Calle Salta, el atentado a la AMIA y otras desgracias le mostraron el coraje que se necesita para ser un verdadero cronista. 
Lo acompaña Romina Tamburello. Guionista, creador de narrativas transmedia, docente, el rosarino bebe de las historias vivas y las hace fluir tanto en el terreno audiovisual como en el más artesanal de los formatos. Es Licenciado en Comunicación Social, Especialista en Comunicación Digital Interactiva (UNR), Director y docente en las licenciaturas de Periodismo y Producción y Realización Audiovisual (UAI). Es periodista gracias a las paperas que coincidieron con el Mundial 1986, cuando tenía 12 años. Allí se declaró maradoniano y amante de los relatos de El Gráfico. Dos años después comenzó a trabajar en Emisora Colón, una radio que transmitía por circuito cerrado, como comentarista de tenis. Y, si bien, nunca ejerció profesionalmente como periodista deportivo, este año ganó el Premio Iberoamericano de Periodismo Rey de España por la historia El jugador que se había olvidado de hacer goles, sobre el gol de Farré que condenó a River a descender de categoría. This talk was given at a TEDx event using the TED conference format but independently organized by a local community. Learn more at https://www.ted.com/tedx",BwZ3QURxbmk,TEDxRosario 2018: Al límite de la ignorancia - 06/10/2018
19,2019-01-29,"Conseguir trabajo, aunque llueva o truene | Malena Famá | TEDxRosario",6723,207,2,35,1104,"['TEDxTalks', 'Spanish', 'Humanities', 'Discrimination', 'Fear', 'Hope', 'Poverty', 'Social Change', 'Social Entrepreneurship', 'Social Interaction', 'Society', 'Volunteering', 'Work']","Malena dirige una organizacion que ayuda a personas en situación de calle a encontrar trabajo. Desde un punto de vista que rara vez sale a luz nos cuenta cómo podemos dar una mano para que la persona que quiere trabajar pueda hacerlo.   Malena nació hace 35 años en San Miguel -conurbano bonaerense- y ahora vive en la Ciudad de Buenos Aires.

Orgullosamente argentina y latinoamericana, algún día se dio cuenta que deseaba dedicar su vida a disminuir la inequidad social y por eso creó y preside Multipolar, una organización social que tiene como objetivo que personas en situación de extrema vulnerabilidad social salgan adelante a través del trabajo decente.

Tal vez un mismo día la encuentra acompañando a una persona que vive en la calle a tramitar un subsidio habitacional para luego salir corriendo a negociar salvaguardas sociales en un proyecto del Banco Mundial.

Vive su vida como un proyecto colectivo buscando generar comunidad basada en la reciprocidad. Por eso, junto con su esposo, Nahuel, decidieron abrir su casa y muchas de las actividades con la población con la que trabajan se desarrollan en su propia vivienda.

Sueña y no se salva. Y es una persona feliz. This talk was given at a TEDx event using the TED conference format but independently organized by a local community. Learn more at https://www.ted.com/tedx",RcwrHsLuUfs,TEDxRosario 2018: Al límite de la ignorancia - 06/10/2018
20,2019-01-28,No tires ese vino picado (la historia secreta del vermut) | Matías Jurisich | TEDxRosario,17373,661,16,40,679,"['TEDxTalks', 'Spanish', 'Humanities', 'Ancient world', 'Botany', 'Creation', 'History', 'Invention', 'Passion', 'Sharing', 'Start-up', 'Time']","Matías nos cuenta la historia de la invención del vermut y luego nos comparte una receta para aprovechar los vinos picados y pasar un buen rato con amigos. Cantinero, fotógrafo amateur y productor de vermut artesanal. Se autoproclamó hace unos años como #GorditoFeliz. Participa en muchos torneos de coctelería. Alguno lo ganó. En otros hizo podio. Y en otros, bueno, lo que pudo. Su mayor hito coctelero es haber hecho gin tonics en un velorio. This talk was given at a TEDx event using the TED conference format but independently organized by a local community. Learn more at https://www.ted.com/tedx",00Irv6pwJXQ,TEDxRosario 2018: Al límite de la ignorancia - 06/10/2018
